{
  "schema_version": "0.1.0",
  "trajectory_id": "synthetic-north-outage-recovery",
  "service_entity_id": "service-north",
  "rate_unit": "m3/h",
  "volume_unit": "m3",
  "time_unit": "h",
  "step_count": 4,
  "first_step_as_of": "2026-10-16T10:00:00Z",
  "last_step_as_of": "2026-10-16T13:00:00Z",
  "initial_state": "adequate",
  "final_state": "adequate",
  "first_adequate_step_id": "recovery",
  "first_adequate_as_of": "2026-10-16T13:00:00Z",
  "preceding_step_id": "outage-2",
  "preceding_step_as_of": "2026-10-16T12:00:00Z",
  "adequacy_maintained_through_last_sample": true,
  "unmet_demand_volume_lower_bound": 150,
  "unmet_demand_volume_upper_bound": 150,
  "customer_delivered_volume_lower_bound": 250,
  "customer_delivered_volume_upper_bound": 250,
  "maximum_normalized_deficit_lower_bound": 1,
  "maximum_normalized_deficit_upper_bound": 1,
  "steps": [
    {
      "step_id": "normal",
      "as_of": "2026-10-16T10:00:00Z",
      "step_hours": 1,
      "state": "adequate",
      "demand_volume_lower_bound": 100,
      "demand_volume_upper_bound": 100,
      "customer_delivered_volume_lower_bound": 100,
      "customer_delivered_volume_upper_bound": 100,
      "ending_storage_lower_bound": 50,
      "ending_storage_upper_bound": 50,
      "conservative_mass_balance_residual": 0,
      "optimistic_mass_balance_residual": 0,
      "coverage_lower_bound": 1.2,
      "coverage_upper_bound": 1.2,
      "supporting_evidence_ids": [],
      "storage_state_origin": "initial_scenario_measurement"
    },
    {
      "step_id": "outage-1",
      "as_of": "2026-10-16T11:00:00Z",
      "step_hours": 1,
      "state": "degraded",
      "demand_volume_lower_bound": 100,
      "demand_volume_upper_bound": 100,
      "customer_delivered_volume_lower_bound": 50,
      "customer_delivered_volume_upper_bound": 50,
      "ending_storage_lower_bound": 0,
      "ending_storage_upper_bound": 0,
      "conservative_mass_balance_residual": 0,
      "optimistic_mass_balance_residual": 0,
      "coverage_lower_bound": 0.5,
      "coverage_upper_bound": 0.5,
      "supporting_evidence_ids": [],
      "storage_state_origin": "derived_from_previous_step",
      "storage_source_step_id": "normal"
    },
    {
      "step_id": "outage-2",
      "as_of": "2026-10-16T12:00:00Z",
      "step_hours": 1,
      "state": "unavailable",
      "demand_volume_lower_bound": 100,
      "demand_volume_upper_bound": 100,
      "customer_delivered_volume_lower_bound": 0,
      "customer_delivered_volume_upper_bound": 0,
      "ending_storage_lower_bound": 0,
      "ending_storage_upper_bound": 0,
      "conservative_mass_balance_residual": 0,
      "optimistic_mass_balance_residual": 0,
      "coverage_lower_bound": 0,
      "coverage_upper_bound": 0,
      "supporting_evidence_ids": [],
      "storage_state_origin": "derived_from_previous_step",
      "storage_source_step_id": "outage-1"
    },
    {
      "step_id": "recovery",
      "as_of": "2026-10-16T13:00:00Z",
      "step_hours": 1,
      "state": "adequate",
      "demand_volume_lower_bound": 100,
      "demand_volume_upper_bound": 100,
      "customer_delivered_volume_lower_bound": 100,
      "customer_delivered_volume_upper_bound": 100,
      "ending_storage_lower_bound": 0,
      "ending_storage_upper_bound": 0,
      "conservative_mass_balance_residual": 0,
      "optimistic_mass_balance_residual": 0,
      "coverage_lower_bound": 1,
      "coverage_upper_bound": 1,
      "supporting_evidence_ids": [],
      "storage_state_origin": "derived_from_previous_step",
      "storage_source_step_id": "outage-2"
    }
  ],
  "supporting_evidence_ids": []
}
